[
  {
    "id":"part2-sleep-q15",
    "module":"Respiratory and ENT",
    "specialty":"Sleep Medicine",
    "topic":"Sleep Medicine",
    "subtopic":"Obstructive sleep apnea diagnostic testing",
    "yearTags":[2022,2020],
    "examPart":"Part II",
    "stemEn":"A child has habitual snoring and excessive daytime sleepiness, raising concern for obstructive sleep apnea. What is the next diagnostic test?",
    "options":[{"key":"A","text":"Polysomnography"}],
    "recalledAnswer":"A",
    "verifiedAnswer":null,
    "answerConfidence":"high",
    "explanationAr":"المصدر يختار Polysomnography. يذكر أن attended overnight PSG هو gold standard لتشخيص obstructive sleep apnea لأنه يحدد obstructive events ويقيس شدة المرض واضطراب gas exchange وsleep arousals.",
    "reasoningEn":"The source identifies attended overnight polysomnography as the definitive diagnostic study for suspected pediatric obstructive sleep apnea.",
    "incorrectOptionsAr":null,
    "keywords":["snoring","daytime sleepiness","obstructive sleep apnea","polysomnography"],
    "clinicalPearl":"Habitual snoring plus daytime sleepiness should prompt formal evaluation for pediatric OSA; the source names PSG as the gold standard.",
    "managementSteps":[],
    "diagnosticSteps":["Obtain overnight polysomnography"],
    "image":{"requiredForQuestion":false,"sourceRef":null,"assetPath":null,"captionAr":null,"captionEn":null,"status":"not_required"},
    "tts":{"enabled":true,"language":"en","text":"A child has habitual snoring and excessive daytime sleepiness, raising concern for obstructive sleep apnea. What is the next diagnostic test? Option A, polysomnography."},
    "sourceRefs":[{"sourceName":"Pediatric Saudi Board Exams Question Collection, 4th Edition, 1 May 2026","year":2026,"part":"Part II","page":18,"questionNumber":"Sleep Medicine Q15","notes":"Part II 2022 and Part II 2020; source answer A."}],
    "verification":{"upToDate":"not_checked","nelson":"not_checked","guideline":"not_checked","referenceNotes":"Source explanation states attended overnight PSG is the gold standard."},
    "duplicateOf":null,
    "reviewStatus":"needs_verification"
  },
  {
    "id":"part2-sleep-q16",
    "module":"Respiratory and ENT",
    "specialty":"Sleep Medicine",
    "topic":"Sleep Medicine",
    "subtopic":"Nightmares versus parasomnias",
    "yearTags":[2022,2021],
    "examPart":"Part II",
    "stemEn":"A 5-year-old wakes frightened during the night. Which feature would support nightmares?",
    "options":[{"key":"A","text":"They occur during REM sleep"},{"key":"B","text":"They occur in the first third of sleep"},{"key":"C","text":"They are not associated with other abnormalities"},{"key":"D","text":"They do not affect sleep"}],
    "recalledAnswer":"A",
    "verifiedAnswer":null,
    "answerConfidence":"high",
    "explanationAr":"المصدر يختار حدوث nightmares خلال REM sleep. هذا هو التفريق الذي يركز عليه السؤال بين nightmares وبين parasomnias الأخرى التي قد ترتبط بمراحل نوم مختلفة.",
    "reasoningEn":"The source-selected distinguishing feature is occurrence during REM sleep.",
    "incorrectOptionsAr":"المصدر لا يقدم شرحًا تفصيليًا مستقلًا لكل خيار في هذه الفقرة، لذلك لم تُضف استبعادات غير مذكورة.",
    "keywords":["nightmares","REM sleep","parasomnia"],
    "clinicalPearl":"In the source, REM timing is the key clue for nightmares.",
    "managementSteps":[],
    "diagnosticSteps":[],
    "image":{"requiredForQuestion":false,"sourceRef":null,"assetPath":null,"captionAr":null,"captionEn":null,"status":"not_required"},
    "tts":{"enabled":true,"language":"en","text":"A 5-year-old wakes frightened during the night. Which feature would support nightmares? Option A, they occur during REM sleep. Option B, they occur in the first third of sleep. Option C, they are not associated with other abnormalities. Option D, they do not affect sleep."},
    "sourceRefs":[{"sourceName":"Pediatric Saudi Board Exams Question Collection, 4th Edition, 1 May 2026","year":2026,"part":"Part II","page":19,"questionNumber":"Sleep Medicine Q16","notes":"Part II 2022 and Part II 2021; source answer A."}],
    "verification":{"upToDate":"not_checked","nelson":"not_checked","guideline":"not_checked","referenceNotes":"Source-derived answer only."},
    "duplicateOf":null,
    "reviewStatus":"needs_verification"
  },
  {
    "id":"part2-sleep-q17",
    "module":"Respiratory and ENT",
    "specialty":"Sleep Medicine",
    "topic":"Sleep Medicine",
    "subtopic":"Late-night awakening parasomnia recall",
    "yearTags":[2023],
    "examPart":"Part II",
    "stemEn":"A child goes to sleep at 8 p.m. and wakes crying at about 4 to 5 a.m.; no additional description was recalled. What is the most likely diagnosis?",
    "options":[{"key":"A","text":"Nightmares"},{"key":"B","text":"Sleep terrors"},{"key":"C","text":"Confusional arousals"}],
    "recalledAnswer":"A",
    "verifiedAnswer":null,
    "answerConfidence":"low",
    "explanationAr":"مفتاح المصدر مطبوع A? ويذكر أن الترجيح كان فقط لأن الحدث وقع في مرحلة متأخرة من النوم. الـrecall ناقص ولا يحتوي وصف الحلم أو الوعي أو amnesia أو autonomic activation، لذلك لا تُحوّل الإجابة إلى verified.",
    "reasoningEn":"The source tentatively favors nightmares based only on late-night timing, while explicitly acknowledging that the recalled vignette lacks discriminating details.",
    "incorrectOptionsAr":"لا توجد تفاصيل كافية في الـrecall لاستبعاد sleep terrors أو confusional arousals بصورة موثوقة؛ لذلك بقي السؤال conflicting.",
    "keywords":["nightmares","sleep terrors","confusional arousals","incomplete recall"],
    "clinicalPearl":"Timing alone is insufficient for a confident parasomnia diagnosis when key behavioral features are missing.",
    "managementSteps":[],
    "diagnosticSteps":[],
    "image":{"requiredForQuestion":false,"sourceRef":null,"assetPath":null,"captionAr":null,"captionEn":null,"status":"not_required"},
    "tts":{"enabled":true,"language":"en","text":"A child goes to sleep at 8 p.m. and wakes crying at about 4 to 5 a.m.; no additional description was recalled. What is the most likely diagnosis? Option A, nightmares. Option B, sleep terrors. Option C, confusional arousals."},
    "sourceRefs":[{"sourceName":"Pediatric Saudi Board Exams Question Collection, 4th Edition, 1 May 2026","year":2026,"part":"Part II","page":20,"questionNumber":"Sleep Medicine Q17","notes":"Part II 2023; source prints A? and states the choice is based only on late sleep timing."}],
    "verification":{"upToDate":"not_checked","nelson":"not_checked","guideline":"not_checked","referenceNotes":"Incomplete recalled stem; source itself is tentative."},
    "duplicateOf":null,
    "reviewStatus":"conflicting"
  },
  {
    "id":"part2-sleep-q18",
    "module":"Respiratory and ENT",
    "specialty":"Sleep Medicine",
    "topic":"Sleep Medicine",
    "subtopic":"Behavioral insomnia of childhood",
    "yearTags":[2024,2022],
    "examPart":"Part II",
    "stemEn":"A child has difficulty falling asleep and requires a specific soothing condition throughout the night, such as being swaddled. What is the probable cause?",
    "options":[{"key":"A","text":"Behavioral insomnia of childhood"},{"key":"B","text":"Depression"},{"key":"C","text":"Night terrors"}],
    "recalledAnswer":"A",
    "verifiedAnswer":null,
    "answerConfidence":"high",
    "explanationAr":"المصدر يختار Behavioral insomnia of childhood ويشرح sleep-onset association type: الطفل يجد صعوبة في النوم أو العودة للنوم دون conditions أو associations محددة مثل rocking أو وجود parent أو favorite object.",
    "reasoningEn":"The source maps dependence on a specific bedtime condition to the sleep-onset association form of behavioral insomnia of childhood.",
    "incorrectOptionsAr":"المصدر لا يربط هذا النمط بـdepression أو night terrors؛ المحور هو dependence on a sleep-onset association.",
    "keywords":["behavioral insomnia","sleep-onset association","swaddling","sleep difficulty"],
    "clinicalPearl":"A child who cannot fall back asleep without the same bedtime association fits the source description of sleep-onset association insomnia.",
    "managementSteps":[],
    "diagnosticSteps":[],
    "image":{"requiredForQuestion":false,"sourceRef":null,"assetPath":null,"captionAr":null,"captionEn":null,"status":"not_required"},
    "tts":{"enabled":true,"language":"en","text":"A child has difficulty falling asleep and requires a specific soothing condition throughout the night, such as being swaddled. What is the probable cause? Option A, behavioral insomnia of childhood. Option B, depression. Option C, night terrors."},
    "sourceRefs":[{"sourceName":"Pediatric Saudi Board Exams Question Collection, 4th Edition, 1 May 2026","year":2026,"part":"Part II","page":20,"questionNumber":"Sleep Medicine Q18","notes":"Part II 2024 and Part II 2022; source answer A."}],
    "verification":{"upToDate":"not_checked","nelson":"not_checked","guideline":"not_checked","referenceNotes":"Source cites American Thoracic Society material on behavioral insomnia of childhood."},
    "duplicateOf":null,
    "reviewStatus":"needs_verification"
  }
]