[
  {
    "id":"part2-ophthalmology-q08","module":"general-paediatrics-outpatients","specialty":"Ophthalmology","topic":"Abnormal eye movements","subtopic":"Infantile nystagmus","yearTags":[2023],"examPart":"Part II",
    "stemEn":"A 4-month-old infant has rhythmic eye movements, particularly on left gaze. The rest of the examination is normal and brain MRI is normal. What diagnosis was favored in the recalled source?",
    "options":[{"key":"A","text":"Congenital nystagmus"},{"key":"B","text":"Neuroblastoma"}],
    "recalledAnswer":"A","verifiedAnswer":null,"answerConfidence":"low",
    "explanationAr":"التجميع يرجّح congenital/infantile nystagmus، لكنه يضع علامة استفهام على المفتاح ويقارن السؤال بسؤال PREP عن spasmus nutans كان يحتوي علامات إضافية مثل torticollis وhead titubation. لذلك أبقيت الإجابة كمفتاح مسترجع فقط ووسمت السؤال conflicting لحين التحقق المستقل.",
    "reasoningEn":"The source tentatively favors congenital nystagmus but explicitly discusses a competing spasmus nutans pattern from a similar PREP item, so the answer is not treated as independently verified.",
    "incorrectOptionsAr":"Neuroblastoma يرتبط عادةً بـ opsoclonus-myoclonus-ataxia مع chaotic multidirectional eye movements وأعراض عصبية أخرى، وليس مجرد rhythmic nystagmus مع فحص طبيعي كما ورد في الاستدعاء.",
    "keywords":["infantile nystagmus","rhythmic eye movements","spasmus nutans","normal MRI"],
    "clinicalPearl":"في infantile nystagmus، وجود head nodding/torticollis أو chaotic multidirectional movements يغيّر التشخيص التفريقي بشكل مهم.",
    "managementSteps":["Arrange pediatric ophthalmology assessment if persistent or atypical"],
    "diagnosticSteps":["Characterize direction and conjugacy of nystagmus","Look for head nodding, torticollis, neurologic signs, and visual impairment"],
    "image":{"requiredForQuestion":false,"sourceRef":null,"assetPath":null,"captionAr":null,"captionEn":null,"status":"not_required"},
    "tts":{"enabled":true,"language":"en","text":"A four-month-old infant has rhythmic eye movements, particularly on left gaze. The rest of the examination is normal and brain MRI is normal. What diagnosis was favored in the recalled source? A. Congenital nystagmus. B. Neuroblastoma."},
    "sourceRefs":[{"sourceName":"Pediatric Saudi Board Exams Question Collection, 4th Edition, 1 May 2026","year":2023,"part":"Part II","page":null,"questionNumber":"Ophthalmology Q8","notes":"Source tentatively marks congenital nystagmus and compares with PREP 2020 spasmus nutans; public stem paraphrased."}],
    "verification":{"upToDate":"not_checked","nelson":"not_checked","guideline":"not_checked","referenceNotes":"Internal source uncertainty preserved; requires independent verification."},
    "duplicateOf":null,"reviewStatus":"conflicting"
  },
  {
    "id":"part2-ophthalmology-q09","module":"general-paediatrics-outpatients","specialty":"Ophthalmology","topic":"Amblyopia","subtopic":"Treatment","yearTags":[2020],"examPart":"Part II",
    "stemEn":"A child is found to have amblyopia and the optometry assessment is otherwise normal. What management option was selected in the recalled source?",
    "options":[{"key":"A","text":"Brain CT"},{"key":"B","text":"Reassurance"},{"key":"C","text":"Refer for eye patching"}],
    "recalledAnswer":"C","verifiedAnswer":null,"answerConfidence":"moderate",
    "explanationAr":"المصدر يختار referral for eye patching. الفكرة أن amblyopia في الطفولة تحتاج treatment of the weaker eye/penalization تحت إشراف مختص؛ التأخير يقلل فرصة استعادة الرؤية. verifiedAnswer يبقى فارغًا حتى المراجعة المستقلة.",
    "reasoningEn":"The recalled source selects patching referral and explains that penalization therapy can improve amblyopia when detected early.",
    "incorrectOptionsAr":"Brain CT ليس علاجًا روتينيًا لـ amblyopia المعزولة، وreassurance وحده قد يفوّت نافذة علاج تطور الرؤية.",
    "keywords":["amblyopia","eye patching","penalization","visual development"],
    "clinicalPearl":"Amblyopia is time-sensitive: treatment is generally more effective when started earlier in childhood.",
    "managementSteps":["Refer to pediatric ophthalmology/qualified pediatric eye-care provider","Institute patching or other penalization as directed"],
    "diagnosticSteps":["Confirm visual acuity asymmetry and ocular alignment","Exclude media opacity or other structural cause"],
    "image":{"requiredForQuestion":false,"sourceRef":null,"assetPath":null,"captionAr":null,"captionEn":null,"status":"not_required"},
    "tts":{"enabled":true,"language":"en","text":"A child is found to have amblyopia and the optometry assessment is otherwise normal. What management option was selected in the recalled source? A. Brain CT. B. Reassurance. C. Refer for eye patching."},
    "sourceRefs":[{"sourceName":"Pediatric Saudi Board Exams Question Collection, 4th Edition, 1 May 2026","year":2020,"part":"Part II","page":null,"questionNumber":"Ophthalmology Q9","notes":"Public stem paraphrased."}],
    "verification":{"upToDate":"not_checked","nelson":"not_checked","guideline":"not_checked","referenceNotes":"Independent verification pending."},
    "duplicateOf":null,"reviewStatus":"needs_verification"
  },
  {
    "id":"part2-ophthalmology-q10","module":"general-paediatrics-outpatients","specialty":"Ophthalmology","topic":"Eyelid lesion","subtopic":"Chalazion","yearTags":[2024,2023],"examPart":"Part II",
    "stemEn":"The original examination image shows a new localized eyelid swelling. Which diagnosis was keyed?",
    "options":[{"key":"A","text":"Chalazion (Hordeolum)"},{"key":"B","text":"Stye"},{"key":"C","text":"Infected nasolacrimal duct obstruction"}],
    "recalledAnswer":"A","verifiedAnswer":null,"answerConfidence":"low",
    "explanationAr":"المصدر يختار A، لكنه يكتب Chalazion (Hordeolum) رغم أن chalazion وhordeolum/stye ليستا مترادفتين سريريًا. لذلك حفظت النص كما ورد كـ recalled answer ووسمت السؤال conflicting. الصورة الأصلية ضرورية قبل النشر لأنها أساس التمييز.",
    "reasoningEn":"The source key is A, but its wording conflates chalazion with hordeolum while option B separately lists stye; the original image is therefore essential to resolve the intended diagnosis.",
    "incorrectOptionsAr":"Stye/hordeolum عادةً مؤلم والتهابي أكثر، بينما chalazion غالبًا painless meibomian gland nodule. Infected nasolacrimal duct obstruction له توزيع وعلامات مختلفة. لا يمكن حسم المقصود دون الصورة الأصلية.",
    "keywords":["chalazion","hordeolum","stye","eyelid swelling","image-dependent"],
    "clinicalPearl":"Chalazion غالبًا painless chronic eyelid nodule؛ hordeolum/stye عادةً tender and acute.",
    "managementSteps":[],
    "diagnosticSteps":["Review the original eyelid image","Assess tenderness, erythema, discharge, and lesion location"],
    "image":{"requiredForQuestion":true,"sourceRef":"Original Ophthalmology Q10 eyelid image","assetPath":null,"captionAr":"الصورة الأصلية مطلوبة للتفريق بين chalazion وhordeolum.","captionEn":"Original eyelid image required to distinguish chalazion from hordeolum.","status":"missing"},
    "tts":{"enabled":true,"language":"en","text":"The original examination image shows a new localized eyelid swelling. Which diagnosis was keyed? A. Chalazion, hordeolum. B. Stye. C. Infected nasolacrimal duct obstruction."},
    "sourceRefs":[{"sourceName":"Pediatric Saudi Board Exams Question Collection, 4th Edition, 1 May 2026","year":null,"part":"Part II","page":null,"questionNumber":"Ophthalmology Q10","notes":"Years 2024 and 2023; source wording conflates chalazion and hordeolum; image-dependent."}],
    "verification":{"upToDate":"not_checked","nelson":"not_checked","guideline":"not_checked","referenceNotes":"Resolve source wording conflict after reviewing original image."},
    "duplicateOf":null,"reviewStatus":"image_missing"
  }
]