[
  {
    "id":"part2-nephro-cystic-q46","module":"nephrology-urology","specialty":"Nephrology and Urologic Disorders","topic":"Cystic Diseases of the Kidneys","subtopic":"Polycystic kidney disease imaging","yearTags":[2018],"examPart":"Part II","stemEn":"A kidney ultrasound picture was provided showing poor or absent corticomedullary differentiation, with the source uncertain whether the image represented ARPKD or ADPKD. Which of the following is correct regarding this diagnosis?","options":[{"key":"A","text":"It is associated with kidney stones"},{"key":"B","text":"[Other options not recalled in source]"}],"recalledAnswer":null,"verifiedAnswer":null,"answerConfidence":"unknown","explanationAr":"المصدر نفسه يضع Correct answer: X ويصرح أنه لم يجد جوابًا، كما أن تحديد التشخيص من الصورة محفوظ بشكل غير مؤكد (?ARPKD or ADPKD). لذلك لا نعتمد أي إجابة، ولا يمكن نشر السؤال قبل استرجاع الصورة الأصلية والخيارات الناقصة.","reasoningEn":"The source explicitly provides no correct answer and is uncertain whether the ultrasound represents ARPKD or ADPKD, so no answer should be inferred.","incorrectOptionsAr":"لا يمكن تقييم خيار kidney stones أو بقية الخيارات بثقة لأن التشخيص والخيارات الأصلية غير مكتملة.","keywords":["corticomedullary differentiation","ARPKD","ADPKD","ultrasound","incomplete recall"],"clinicalPearl":"Do not infer a cystic-kidney diagnosis from an incomplete image description; imaging pattern, age, family history, liver findings and cyst distribution all matter.","managementSteps":[],"diagnosticSteps":["Recover and review the original ultrasound image","Recover the complete option set"],"image":{"requiredForQuestion":true,"sourceRef":"Pediatric Saudi Board Exams Question Collection 4th Ed 2026 Q46","assetPath":null,"captionAr":"صورة kidney ultrasound هي أساس السؤال، والمصدر نفسه غير متأكد هل تمثل ARPKD أو ADPKD.","captionEn":"Kidney ultrasound is essential; the source itself is uncertain whether it represents ARPKD or ADPKD.","status":"missing"},"tts":{"enabled":true,"language":"en","text":null},"sourceRefs":[{"sourceName":"Pediatric Saudi Board Exams Question Collection 4th Ed 2026","year":2018,"part":"Part II","page":null,"questionNumber":"Q46","notes":"Source states Correct answer: X and did not identify a definitive diagnosis; only one option retained."}],"verification":{"upToDate":"not_checked","nelson":"not_checked","guideline":"not_checked","referenceNotes":"Cannot verify until original image/options are recovered."},"duplicateOf":null,"reviewStatus":"incomplete_recall"},
  {
    "id":"part2-nephro-cystic-q47","module":"nephrology-urology","specialty":"Nephrology and Urologic Disorders","topic":"Cystic Diseases of the Kidneys","subtopic":"Autosomal recessive polycystic kidney disease","yearTags":[2023,2022],"examPart":"Part II","stemEn":"A newborn presented with bilateral kidney masses and an X-ray was provided. What is the most likely diagnosis?","options":[{"key":"A","text":"Autosomal recessive polycystic kidney disease (ARPKD)"},{"key":"B","text":"Bilateral Wilms tumor"},{"key":"C","text":"Bilateral neuroblastoma"}],"recalledAnswer":"A","verifiedAnswer":null,"answerConfidence":"low","explanationAr":"المصدر يضع ARPKD بعلامة استفهام ويذكر أن X-ray ليست الطريقة المعتادة لتشخيص ARPKD، كما يشير إلى سؤال مشابه في PREP 2019 أجاب multicystic dysplastic kidney. لذلك نحفظ recalledAnswer=A لكن نضع السؤال conflicting حتى تُراجع الصورة الأصلية.","reasoningEn":"The source tentatively keys ARPKD, but also flags the imaging modality as atypical and cites a similar question with a different diagnosis, creating a source-level conflict.","incorrectOptionsAr":"Bilateral Wilms وbilateral neuroblastoma قد يسببان masses لكن لا يمكن ترجيحهما أو استبعادهما بدقة دون الصورة. المصدر لا يقدم تفسيرًا كافيًا يسمح بحسم السؤال من النص وحده.","keywords":["newborn","bilateral renal masses","ARPKD","image-dependent","source conflict"],"clinicalPearl":"ARPKD classically shows bilaterally enlarged echogenic kidneys with poor corticomedullary differentiation and tiny collecting-duct cysts on ultrasound.","managementSteps":[],"diagnosticSteps":["Recover and review the original image","Correlate with renal ultrasound and clinical context"],"image":{"requiredForQuestion":true,"sourceRef":"Pediatric Saudi Board Exams Question Collection 4th Ed 2026 Q47","assetPath":null,"captionAr":"الصورة الأصلية ضرورية لأن المصدر نفسه يشكك في تشخيص ARPKD من الـX-ray.","captionEn":"Original image is essential because the source itself questions the ARPKD interpretation from an X-ray.","status":"missing"},"tts":{"enabled":true,"language":"en","text":null},"sourceRefs":[{"sourceName":"Pediatric Saudi Board Exams Question Collection 4th Ed 2026","year":2023,"part":"Part II","page":null,"questionNumber":"Q47","notes":"Also recalled 2022. Source writes A? and notes X-ray is atypical; similar PREP 2019 idea reportedly answered multicystic dysplastic kidney."}],"verification":{"upToDate":"not_checked","nelson":"not_checked","guideline":"not_checked","referenceNotes":"High-priority image-dependent conflict."},"duplicateOf":null,"reviewStatus":"conflicting"},
  {
    "id":"part2-nephro-cystic-q48","module":"nephrology-urology","specialty":"Nephrology and Urologic Disorders","topic":"Cystic Diseases of the Kidneys","subtopic":"ADPKD intracranial aneurysm complication","yearTags":[2022,2017],"examPart":"Part II","stemEn":"An adolescent known to have autosomal dominant polycystic kidney disease presented with new-onset neurological symptoms. What is the most likely cause?","options":[{"key":"A","text":"Subarachnoid hemorrhage"},{"key":"B","text":"Brain abscess"},{"key":"C","text":"Brain cyst"}],"recalledAnswer":"A","verifiedAnswer":null,"answerConfidence":"high","explanationAr":"ADPKD يرتبط intracranial aneurysms؛ rupture قد يسبب subarachnoid hemorrhage مع acute severe neurological symptoms. لذلك المصدر يختار SAH.","reasoningEn":"A ruptured intracranial aneurysm is a serious extra-renal complication of ADPKD and can present with subarachnoid hemorrhage.","incorrectOptionsAr":"Brain abscess وbrain cyst ليستا الـclassic neurologic complication المرتبطة بـADPKD في هذا السؤال.","keywords":["ADPKD","intracranial aneurysm","subarachnoid hemorrhage","neurologic symptoms"],"clinicalPearl":"Sudden severe headache or acute neurologic symptoms in ADPKD should raise concern for intracranial aneurysm rupture.","managementSteps":["Urgent neurologic evaluation and appropriate brain imaging for suspected SAH"],"diagnosticSteps":[],"image":null,"tts":{"enabled":true,"language":"en","text":null},"sourceRefs":[{"sourceName":"Pediatric Saudi Board Exams Question Collection 4th Ed 2026","year":2022,"part":"Part II","page":null,"questionNumber":"Q48","notes":"Also recalled 2017."}],"verification":{"upToDate":"not_checked","nelson":"not_checked","guideline":"not_checked","referenceNotes":"Independent verification pending."},"duplicateOf":null,"reviewStatus":"needs_verification"}
]
