[
{"id":"part2-trauma-q39","module":"paediatric-emergency-medicine","specialty":"Trauma and Accidents","topic":"Trauma and Accidents","subtopic":"Caustic and Foreign Body Ingestion","yearTags":[2023,2018],"examPart":"Part II","stemEn":"An 18-month-old child develops sudden cough, and chest radiography shows findings of an aspirated airway foreign body. What is the diagnosis?","options":[{"key":"A","text":"Foreign body aspiration"}],"recalledAnswer":"A","verifiedAnswer":null,"answerConfidence":"unknown","explanationAr":"المصدر يختار foreign body aspiration، مع ذكر أن الأشعة قد تظهر unilateral hyperinflation، atelectasis، mediastinal shift أو pneumonia distal to obstruction.","clinicalPearl":"Sudden cough plus unilateral radiographic air trapping strongly suggests foreign body aspiration.","image":{"requiredForQuestion":true,"sourceRef":"Part II Trauma Q39 chest radiograph","assetPath":null,"status":"missing","captionEn":"Original source radiograph required before publication.","captionAr":"الأشعة الأصلية مطلوبة قبل النشر."},"tts":{"enabled":true,"language":"en","text":"An 18-month-old child develops sudden cough and chest radiography suggests an aspirated airway foreign body. What is the diagnosis? Option A. Foreign body aspiration."},"sourceRefs":[{"sourceName":"Pediatric Saudi Board Exams Question Collection, 4th Edition, 1 May 2026","part":"Part II","questionNumber":"Q39"}],"verification":{"upToDate":"not_checked","nelson":"not_checked","guideline":"not_checked"},"reviewStatus":"image_missing"},
{"id":"part2-trauma-q40","module":"paediatric-emergency-medicine","specialty":"Trauma and Accidents","topic":"Trauma and Accidents","subtopic":"Caustic and Foreign Body Ingestion","yearTags":[2024,2017],"examPart":"Part II","stemEn":"A child has sudden cough and unilateral right-sided wheeze. AP and lateral chest radiographs show a nail in the right bronchus. What is the next step?","options":[{"key":"A","text":"Urgent bronchoscopy"},{"key":"B","text":"Salbutamol"},{"key":"C","text":"Racemic epinephrine"},{"key":"D","text":"Dexamethasone"}],"recalledAnswer":"A","verifiedAnswer":null,"answerConfidence":"unknown","explanationAr":"المصدر يختار urgent bronchoscopy؛ وجود جسم غريب واضح داخل bronchus يحتاج إزالة وليس علاج bronchospasm فقط.","clinicalPearl":"Confirmed bronchial foreign body requires bronchoscopic removal.","image":{"requiredForQuestion":true,"sourceRef":"Part II Trauma Q40 AP/lateral chest radiographs","assetPath":null,"status":"missing","captionEn":"Original source radiographs required before publication.","captionAr":"الأشعة الأصلية مطلوبة قبل النشر."},"tts":{"enabled":true,"language":"en","text":"A child has sudden cough and right-sided wheeze. Chest radiographs show a nail in the right bronchus. What is the next step? Option A. Urgent bronchoscopy. Option B. Salbutamol. Option C. Racemic epinephrine. Option D. Dexamethasone."},"sourceRefs":[{"sourceName":"Pediatric Saudi Board Exams Question Collection, 4th Edition, 1 May 2026","part":"Part II","questionNumber":"Q40"}],"verification":{"upToDate":"not_checked","nelson":"not_checked","guideline":"not_checked"},"reviewStatus":"image_missing"},
{"id":"part2-trauma-q41","module":"paediatric-emergency-medicine","specialty":"Trauma and Accidents","topic":"Trauma and Accidents","subtopic":"Caustic and Foreign Body Ingestion","yearTags":[2025],"examPart":"Part II","stemEn":"An infant has acute shortness of breath, decreased right-sided air entry, and right lung hyperinflation on chest radiograph. What management is selected?","options":[{"key":"A","text":"Urgent bronchoscopy"},{"key":"B","text":"Chest CT"},{"key":"C","text":"Salbutamol"}],"recalledAnswer":"A","verifiedAnswer":null,"answerConfidence":"unknown","explanationAr":"مفتاح المصدر هو urgent bronchoscopy في سياق صورة توحي air trapping من foreign body aspiration.","clinicalPearl":"Unilateral hyperinflation with acute symptoms is a classic airway foreign-body clue.","image":{"requiredForQuestion":true,"sourceRef":"Part II Trauma Q41 chest radiograph","assetPath":null,"status":"missing","captionEn":"Original source radiograph required before publication.","captionAr":"الأشعة الأصلية مطلوبة قبل النشر."},"tts":{"enabled":true,"language":"en","text":"An infant has acute shortness of breath, decreased right-sided air entry, and right lung hyperinflation on chest radiograph. What management is selected? Option A. Urgent bronchoscopy. Option B. Chest CT. Option C. Salbutamol."},"sourceRefs":[{"sourceName":"Pediatric Saudi Board Exams Question Collection, 4th Edition, 1 May 2026","part":"Part II","questionNumber":"Q41"}],"verification":{"upToDate":"not_checked","nelson":"not_checked","guideline":"not_checked"},"reviewStatus":"image_missing"},
{"id":"part2-trauma-q42","module":"paediatric-emergency-medicine","specialty":"Trauma and Accidents","topic":"Trauma and Accidents","subtopic":"Caustic and Foreign Body Ingestion","yearTags":[2025,2017],"examPart":"Part II","stemEn":"A child swallowed a button battery 3 days ago and now has hematemesis. Abdominal radiograph shows the battery still in the stomach. What is the management?","options":[{"key":"A","text":"Reassure and observe"},{"key":"B","text":"Emergency endoscopy"}],"recalledAnswer":"B","verifiedAnswer":null,"answerConfidence":"unknown","explanationAr":"المصدر يختار emergency endoscopy لأن الطفل symptomatic والبطارية ما زالت بالمعدة.","clinicalPearl":"Symptoms after gastric button-battery ingestion change management toward urgent removal.","image":{"requiredForQuestion":true,"sourceRef":"Part II Trauma Q42 abdominal radiograph","assetPath":null,"status":"missing","captionEn":"Original source radiograph required before publication.","captionAr":"الأشعة الأصلية مطلوبة قبل النشر."},"tts":{"enabled":true,"language":"en","text":"A child swallowed a button battery three days ago and now has hematemesis. The battery remains in the stomach. What is the management? Option A. Reassure and observe. Option B. Emergency endoscopy."},"sourceRefs":[{"sourceName":"Pediatric Saudi Board Exams Question Collection, 4th Edition, 1 May 2026","part":"Part II","questionNumber":"Q42"}],"verification":{"upToDate":"not_checked","nelson":"not_checked","guideline":"not_checked"},"reviewStatus":"image_missing"},
{"id":"part2-trauma-q43","module":"paediatric-emergency-medicine","specialty":"Trauma and Accidents","topic":"Trauma and Accidents","subtopic":"Caustic and Foreign Body Ingestion","yearTags":[2018],"examPart":"Part II","stemEn":"A child swallowed multiple magnets 2 days ago, and abdominal radiography shows several magnets in the stomach. What should be done?","options":[{"key":"A","text":"Urgent referral for removal"},{"key":"B","text":"Observation only"}],"recalledAnswer":"A","verifiedAnswer":null,"answerConfidence":"unknown","explanationAr":"المصدر يختار urgent removal ويذكر خطر pressure necrosis/perforation مع multiple magnets.","clinicalPearl":"Multiple magnets are substantially more dangerous than a single inert foreign body.","image":{"requiredForQuestion":true,"sourceRef":"Part II Trauma Q43 abdominal radiograph","assetPath":null,"status":"missing","captionEn":"Original source radiograph required before publication.","captionAr":"الأشعة الأصلية مطلوبة قبل النشر."},"tts":{"enabled":true,"language":"en","text":"A child swallowed multiple magnets two days ago. Several magnets remain in the stomach. What should be done? Option A. Urgent referral for removal. Option B. Observation only."},"sourceRefs":[{"sourceName":"Pediatric Saudi Board Exams Question Collection, 4th Edition, 1 May 2026","part":"Part II","questionNumber":"Q43"}],"verification":{"upToDate":"not_checked","nelson":"not_checked","guideline":"not_checked"},"reviewStatus":"image_missing"},
{"id":"part2-trauma-q44","module":"paediatric-emergency-medicine","specialty":"Trauma and Accidents","topic":"Trauma and Accidents","subtopic":"Caustic and Foreign Body Ingestion","yearTags":[2023],"examPart":"Part II","stemEn":"A child has caustic ingestion with lip erythema and concern for posterior pharyngeal involvement but is stable and tolerating oral intake. What is the next step?","options":[{"key":"A","text":"Admit, keep NPO, and perform endoscopy the next day"},{"key":"B","text":"Admit, keep NPO, start steroids and IV antibiotics, and perform endoscopy"},{"key":"C","text":"Admit and allow oral intake"},{"key":"D","text":"Discharge home"}],"recalledAnswer":"A","verifiedAnswer":null,"answerConfidence":"unknown","explanationAr":"المصدر يختار admission + NPO + endoscopic evaluation. ويشرح أن oral lesions/symptoms تجعل المراقبة المنزلية غير مناسبة، بينما steroids/antibiotics ليست routine لكل حالة.","clinicalPearl":"Caustic ingestion with oral lesions warrants structured inpatient evaluation.","tts":{"enabled":true,"language":"en","text":"A child has caustic ingestion with lip erythema and concern for pharyngeal involvement. What is the next step? Option A. Admit, keep NPO, and perform endoscopy the next day. Option B. Admit, keep NPO, start steroids and IV antibiotics, and perform endoscopy. Option C. Admit and allow oral intake. Option D. Discharge home."},"sourceRefs":[{"sourceName":"Pediatric Saudi Board Exams Question Collection, 4th Edition, 1 May 2026","part":"Part II","questionNumber":"Q44"}],"verification":{"upToDate":"not_checked","nelson":"not_checked","guideline":"not_checked"},"reviewStatus":"needs_verification"}
]