[
{"id":"part2-endo-thyroid-q20","module":"diabetes-endocrinology-metabolic","specialty":"Endocrinology","topic":"Congenital hypothyroidism","yearTags":[2019],"examPart":"Part II","stemEn":"A newborn screen shows high TSH and low T4. If untreated, which clinical finding is likely to develop?","options":[{"key":"A","text":"Prolonged jaundice"}],"recalledAnswer":"A","verifiedAnswer":"A","answerConfidence":"high","explanationAr":"Congenital hypothyroidism غالبًا لا يكون واضحًا عند الولادة، ثم تظهر lethargy, poor feeding, constipation, macroglossia, umbilical hernia وprolonged jaundice خلال الأسابيع الأولى.","reasoningEn":"Prolonged jaundice is a recognized early manifestation of untreated congenital hypothyroidism.","incorrectOptionsAr":"لا توجد خيارات أخرى في الـrecall.","keywords":["high TSH","low T4","prolonged jaundice"],"clinicalPearl":"Treatment should begin promptly after confirmation to protect neurodevelopment.","image":null,"tts":{"enabled":true,"language":"en","text":"A newborn screen shows high TSH and low T4. If untreated, which clinical finding is likely to develop?"},"sourceRefs":[{"sourceName":"Pediatric Saudi Board Exams Question Collection 4th Edition","year":2019,"part":"Part II","page":168,"questionNumber":"Endocrinology Q20"}],"verification":{"upToDate":"supports","nelson":"not_checked","guideline":"not_checked","referenceNotes":"Source quotes UpToDate."},"duplicateOf":null,"reviewStatus":"needs_verification"},
{"id":"part2-endo-thyroid-q21","module":"diabetes-endocrinology-metabolic","specialty":"Endocrinology","topic":"Thyroid nodule","yearTags":[2019],"examPart":"Part II","stemEn":"A 12-year-old girl has a solitary thyroid nodule. What is part of the initial evaluation?","options":[{"key":"A","text":"Measure thyroid function, especially TSH"},{"key":"B","text":"Immediate fine-needle biopsy in every case"},{"key":"C","text":"Immediate excisional biopsy"}],"recalledAnswer":"A","verifiedAnswer":"A","answerConfidence":"high","explanationAr":"Initial thyroid nodule workup يشمل history/exam، TSH، وthyroid ultrasound. FNA يعتمد على ultrasound features وحجم العقدة وعوامل الخطورة.","reasoningEn":"Serum TSH and ultrasound are standard initial steps in thyroid nodule evaluation.","incorrectOptionsAr":"FNA/excision ليست تلقائية لكل nodule بدون risk stratification.","keywords":["thyroid nodule","TSH","ultrasound"],"clinicalPearl":"Pediatric thyroid nodules carry a higher malignancy proportion than adult nodules and need careful evaluation.","image":null,"tts":{"enabled":true,"language":"en","text":"A 12-year-old girl has a solitary thyroid nodule. What is part of the initial evaluation?"},"sourceRefs":[{"sourceName":"Pediatric Saudi Board Exams Question Collection 4th Edition","year":2019,"part":"Part II","page":169,"questionNumber":"Endocrinology Q21"}],"verification":{"upToDate":"supports","nelson":"not_checked","guideline":"not_checked","referenceNotes":"Source quotes UpToDate."},"duplicateOf":null,"reviewStatus":"needs_verification"},
{"id":"part2-endo-thyroid-q22","module":"diabetes-endocrinology-metabolic","specialty":"Endocrinology","topic":"Graves disease","yearTags":[2022,2018,2017],"examPart":"Part II","stemEn":"A 10-year-old girl has goiter, weight loss, palpitations, and warm extremities from Graves disease. What is the preferred initial antithyroid medication?","options":[{"key":"A","text":"Methimazole"},{"key":"B","text":"Radioactive iodine"},{"key":"C","text":"Propranolol alone"},{"key":"D","text":"Surgery"}],"recalledAnswer":"A","verifiedAnswer":"A","answerConfidence":"high","explanationAr":"Methimazole هو preferred first-line antithyroid drug في الأطفال بسبب فعاليته ومخاطر أقل من PTU. Beta-blocker يساعد الأعراض لكنه لا يعالج فرط تصنيع الهرمون.","reasoningEn":"Methimazole is the preferred initial antithyroid drug for pediatric Graves disease.","incorrectOptionsAr":"RAI/surgery options definitive in selected cases; propranolol is adjunctive symptomatic therapy only.","keywords":["Graves","methimazole"],"clinicalPearl":"Avoid PTU in children because of severe hepatotoxicity risk.","image":{"requiredForQuestion":true,"sourceRef":"source page 169 goiter image","assetPath":null,"captionAr":"الصورة الأصلية مطلوبة إذا كان التشخيص بصريًا.","captionEn":"Original goiter image required if visually diagnostic.","status":"missing"},"tts":{"enabled":true,"language":"en","text":"A 10-year-old girl has goiter, weight loss, palpitations, and warm extremities from Graves disease. What is the preferred initial antithyroid medication?"},"sourceRefs":[{"sourceName":"Pediatric Saudi Board Exams Question Collection 4th Edition","year":2022,"part":"Part II","page":169,"questionNumber":"Endocrinology Q22"}],"verification":{"upToDate":"supports","nelson":"not_checked","guideline":"not_checked","referenceNotes":"Source quotes UpToDate."},"duplicateOf":null,"reviewStatus":"image_missing"},
{"id":"part2-endo-thyroid-q23","module":"diabetes-endocrinology-metabolic","specialty":"Endocrinology","topic":"Graves disease","yearTags":[2025],"examPart":"Part II","stemEn":"A young patient has symptomatic hyperthyroidism with goiter. Which drug is preferred if available among the choices?","options":[{"key":"A","text":"Methimazole"},{"key":"B","text":"Radioactive iodine"},{"key":"C","text":"Propranolol for symptom control"},{"key":"D","text":"Surgery"}],"recalledAnswer":"A","verifiedAnswer":"A","answerConfidence":"high","explanationAr":"نفس مبدأ السؤال السابق: Methimazole هو initial disease-directed treatment المعتاد، وpropranolol يضاف لتخفيف tachycardia/tremor عند الحاجة.","reasoningEn":"Methimazole is preferred initial antithyroid therapy in most children with Graves disease.","incorrectOptionsAr":"RAI/surgery حالات مختارة؛ beta blocker adjunct فقط.","keywords":["hyperthyroidism","methimazole"],"clinicalPearl":"Monitor for agranulocytosis symptoms and liver-related adverse effects according to local practice.","image":{"requiredForQuestion":true,"sourceRef":"source page 170 goiter image","assetPath":null,"captionAr":"الصورة الأصلية مطلوبة.","captionEn":"Original image required.","status":"missing"},"tts":{"enabled":true,"language":"en","text":"A young patient has symptomatic hyperthyroidism with goiter. Which drug is preferred if available among the choices?"},"sourceRefs":[{"sourceName":"Pediatric Saudi Board Exams Question Collection 4th Edition","year":2025,"part":"Part II","page":170,"questionNumber":"Endocrinology Q23"}],"verification":{"upToDate":"supports","nelson":"not_checked","guideline":"not_checked","referenceNotes":"Duplicate concept of Q22."},"duplicateOf":"part2-endo-thyroid-q22","reviewStatus":"deduplicated"},
{"id":"part2-endo-thyroid-q24","module":"diabetes-endocrinology-metabolic","specialty":"Endocrinology","topic":"Graves ophthalmopathy","yearTags":[2020],"examPart":"Part II","stemEn":"A child with Graves disease on methimazole has clinically significant ophthalmopathy. What is the appropriate next step?","options":[{"key":"A","text":"Refer for specialist ophthalmic/orbital assessment"},{"key":"B","text":"Switch to propylthiouracil"},{"key":"C","text":"Give radioactive iodine without considering eye disease"},{"key":"D","text":"Add thyroxine routinely"}],"recalledAnswer":"A","verifiedAnswer":"A","answerConfidence":"high","explanationAr":"Graves orbitopathy في الأطفال غالبًا mild، لكن significant symptoms أو impaired eye movements تستدعي early ophthalmology/orbital specialist assessment. PTU ليس خيارًا أفضل بسبب hepatotoxicity.","reasoningEn":"Significant Graves orbitopathy should prompt specialist eye assessment; treatment depends on activity and severity.","incorrectOptionsAr":"PTU غير مفضل؛ RAI قد يؤثر على orbitopathy ويحتاج specialist planning؛ block-and-replace ليس routine answer هنا.","keywords":["Graves ophthalmopathy","ophthalmology referral"],"clinicalPearl":"Most pediatric Graves eye disease is mild, but vision-threatening disease requires urgent specialist care.","image":null,"tts":{"enabled":true,"language":"en","text":"A child with Graves disease on methimazole has clinically significant ophthalmopathy. What is the appropriate next step?"},"sourceRefs":[{"sourceName":"Pediatric Saudi Board Exams Question Collection 4th Edition","year":2020,"part":"Part II","page":170,"questionNumber":"Endocrinology Q24"}],"verification":{"upToDate":"not_checked","nelson":"not_checked","guideline":"supports","referenceNotes":"Source cites 2022 European Thyroid Association guidance."},"duplicateOf":null,"reviewStatus":"needs_verification"}
]