[
  {
    "id":"part2-ent-q01","module":"general-paediatrics-outpatients","specialty":"ENT","topic":"Newborn hearing screening","subtopic":"Congenital CMV evaluation","yearTags":[2025],"examPart":"Part II",
    "stemEn":"A 2-week-old newborn fails the repeat hearing screen in the right ear. What was the next step selected in the recalled source?",
    "options":[{"key":"A","text":"Reassure"},{"key":"B","text":"Repeat the hearing test after 6 weeks"},{"key":"C","text":"Brain MRI"},{"key":"D","text":"Urine CMV testing"}],
    "recalledAnswer":"D","verifiedAnswer":null,"answerConfidence":"moderate",
    "explanationAr":"المصدر يختار urine CMV testing لطفل عمره أسبوعان لم يجتز repeat hearing screen. هذا سؤال guideline-sensitive لذلك أبقيت الإجابة كمفتاح مسترجع فقط حتى المراجعة المستقلة، مع الحفاظ على العمر لأنه مهم جدًا في تقييم congenital CMV.",
    "reasoningEn":"The recalled source selects urine CMV testing after a second failed unilateral newborn hearing screen at two weeks of age.",
    "incorrectOptionsAr":"Reassurance وحدها لا تتماشى مع فشل screening متكرر. إعادة الفحص لاحقًا أو MRI قد تكون أجزاء من تقييم السمع بحسب المسار السريري، لكن المصدر يختار CMV testing في هذه المرحلة.",
    "keywords":["newborn hearing screen","failed repeat screen","congenital CMV","urine CMV"],
    "clinicalPearl":"عمر الرضيع وتوقيت اختبار CMV مهمان عند محاولة إثبات congenital CMV في سياق hearing loss.",
    "managementSteps":["Arrange definitive audiologic follow-up according to the local newborn hearing pathway"],
    "diagnosticSteps":["Obtain source-recalled urine CMV test","Confirm hearing status with appropriate audiologic testing"],
    "image":{"requiredForQuestion":false,"sourceRef":null,"assetPath":null,"captionAr":null,"captionEn":null,"status":"not_required"},
    "tts":{"enabled":true,"language":"en","text":"A two-week-old newborn fails the repeat hearing screen in the right ear. What was the next step selected in the recalled source? A. Reassure. B. Repeat the hearing test after six weeks. C. Brain MRI. D. Urine CMV testing."},
    "sourceRefs":[{"sourceName":"Pediatric Saudi Board Exams Question Collection, 4th Edition, 1 May 2026","year":2025,"part":"Part II","page":null,"questionNumber":"ENT Q1","notes":"Public stem paraphrased; source cites newborn hearing screening algorithms from Nelson/Cummings."}],
    "verification":{"upToDate":"not_checked","nelson":"not_checked","guideline":"not_checked","referenceNotes":"Guideline-sensitive item; independent verification pending."},
    "duplicateOf":null,"reviewStatus":"needs_verification"
  },
  {
    "id":"part2-ent-q02","module":"general-paediatrics-outpatients","specialty":"ENT","topic":"Otitis media with effusion","subtopic":"Hearing assessment in language delay","yearTags":[2023],"examPart":"Part II",
    "stemEn":"An 18-month-old with recurrent otitis media has language delay and is poorly cooperative during examination. Which test was selected from the recalled options to assess him?",
    "options":[{"key":"A","text":"Pure-tone audiometry"},{"key":"B","text":"Tympanometry"},{"key":"C","text":"Otoacoustic emissions"},{"key":"D","text":"Brainstem evoked response"}],
    "recalledAnswer":"B","verifiedAnswer":null,"answerConfidence":"moderate",
    "explanationAr":"المصدر يختار tympanometry من الخيارات الموجودة، ويربط recurrent otitis media/OME بـ hearing loss وlanguage delay. لكنه يذكر أيضًا أن سؤالًا مشابهًا في General Pediatrics Board Review كان يحتوي خيارًا إضافيًا هو referral to a pediatric audiologist وكان هو الأفضل هناك. لذلك لم أحوّل B إلى verifiedAnswer.",
    "reasoningEn":"Within the recalled exam choices, tympanometry was keyed. The source itself notes that pediatric audiology referral would have been preferred if that option had been present.",
    "incorrectOptionsAr":"Pure-tone audiometry قد يصعب في طفل غير متعاون بهذا العمر. OAE وbrainstem response يقيسان جوانب مختلفة من السمع، لكن المصدر لم يخترهما لهذا السيناريو. وجود language delay يجعل التقييم السمعي المتخصص مهمًا.",
    "keywords":["otitis media with effusion","language delay","tympanometry","hearing loss","uncooperative toddler"],
    "clinicalPearl":"Persistent OME with hearing concerns or language delay should trigger formal hearing assessment rather than observation alone.",
    "managementSteps":["Arrange pediatric audiology/ENT follow-up when hearing or language concerns persist"],
    "diagnosticSteps":["Perform tympanometry as recalled in the source","Obtain age-appropriate formal hearing assessment"],
    "image":{"requiredForQuestion":false,"sourceRef":null,"assetPath":null,"captionAr":null,"captionEn":null,"status":"not_required"},
    "tts":{"enabled":true,"language":"en","text":"An eighteen-month-old with recurrent otitis media has language delay and is poorly cooperative during examination. Which test was selected from the recalled options to assess him? A. Pure-tone audiometry. B. Tympanometry. C. Otoacoustic emissions. D. Brainstem evoked response."},
    "sourceRefs":[{"sourceName":"Pediatric Saudi Board Exams Question Collection, 4th Edition, 1 May 2026","year":2023,"part":"Part II","page":null,"questionNumber":"ENT Q2","notes":"Source compares with General Pediatrics Board Review 3rd ed. 2020 Q60 and notes pediatric audiologist referral would be preferred if offered."}],
    "verification":{"upToDate":"not_checked","nelson":"not_checked","guideline":"not_checked","referenceNotes":"Source-qualified recalled answer; independent verification pending."},
    "duplicateOf":null,"reviewStatus":"needs_verification"
  }
]